{
  "schema_version": 11,
  "base_texture": "echoblackboxprotocol:textures/entity/rendercore_echo_mobs/command_remnant.png",
  "glow_texture": "echoblackboxprotocol:textures/entity/rendercore_echo_mobs/command_remnant_glow.png",
  "damaged_overlay_texture": "echoblackboxprotocol:textures/entity/rendercore_echo_mobs/command_remnant_damage_overlay.png",
  "corrupted_overlay_texture": "echoblackboxprotocol:textures/entity/rendercore_echo_mobs/command_remnant_corrupted_overlay.png",
  "active_overlay_texture": "echoblackboxprotocol:textures/entity/rendercore_echo_mobs/command_remnant_active_overlay.png",
  "animation_profile": "echoblackboxprotocol:echo_mobs/command_remnant",
  "particle_profile": "echoblackboxprotocol:echo_mobs/command_remnant",
  "default_state": "IDLE",
  "transition_seconds": 0.18,
  "effect": {
    "preset": "hologram",
    "glow_intensity": 1.1,
    "pulse_speed": 1.15,
    "pulse_min_alpha": 0.55,
    "pulse_max_alpha": 1.0,
    "flicker_intensity": 0.16,
    "scanline_strength": 0.22,
    "target_scope": "entity"
  },
  "materials": {
    "echo_emissive": {
      "color": "#FF8A2B",
      "alpha": 0.92,
      "emissive": true,
      "blend_mode": "additive",
      "light_mode": "emissive",
      "render_pass": "emissive",
      "effect": {
        "preset": "hologram",
        "glow_intensity": 1.1,
        "pulse_speed": 1.15,
        "pulse_min_alpha": 0.55,
        "pulse_max_alpha": 1.0,
        "flicker_intensity": 0.16,
        "scanline_strength": 0.22,
        "target_scope": "entity"
      }
    },
    "damage_heat": {
      "color": "#FFFF7A28",
      "alpha": 0.75,
      "emissive": true,
      "blend_mode": "additive",
      "light_mode": "emissive",
      "render_pass": "emissive",
      "effect": {
        "preset": "neon",
        "glow_intensity": 0.8,
        "pulse_speed": 3.0,
        "pulse_min_alpha": 0.45,
        "pulse_max_alpha": 0.9,
        "target_scope": "entity"
      }
    },
    "corruption": {
      "color": "#FFB45CFF",
      "alpha": 0.72,
      "emissive": true,
      "blend_mode": "additive",
      "light_mode": "emissive",
      "render_pass": "emissive",
      "effect": {
        "preset": "hologram",
        "glow_intensity": 0.75,
        "scanline_strength": 0.35,
        "pulse_speed": 2.2,
        "target_scope": "entity"
      }
    }
  },
  "layers": [
    {
      "id": "core_glow",
      "kind": "glow",
      "texture": "echoblackboxprotocol:textures/entity/rendercore_echo_mobs/command_remnant_glow.png",
      "material": "echo_emissive",
      "states": [
        "ONLINE",
        "IDLE",
        "ACTIVE",
        "WORKING",
        "SCANNING",
        "CHARGING",
        "COMPLETE"
      ]
    },
    {
      "id": "active_motion_overlay",
      "kind": "overlay",
      "texture": "echoblackboxprotocol:textures/entity/rendercore_echo_mobs/command_remnant_active_overlay.png",
      "material": "echo_emissive",
      "states": [
        "ACTIVE",
        "WORKING",
        "SCANNING",
        "CHARGING"
      ]
    },
    {
      "id": "damage_heat_overlay",
      "kind": "overlay",
      "texture": "echoblackboxprotocol:textures/entity/rendercore_echo_mobs/command_remnant_damage_overlay.png",
      "material": "damage_heat",
      "states": [
        "DAMAGED",
        "OVERHEATED",
        "FAILED"
      ]
    },
    {
      "id": "corruption_overlay",
      "kind": "overlay",
      "texture": "echoblackboxprotocol:textures/entity/rendercore_echo_mobs/command_remnant_corrupted_overlay.png",
      "material": "corruption",
      "states": [
        "CORRUPTED"
      ]
    }
  ],
  "state_animations": {
    "IDLE": "idle",
    "ONLINE": "idle",
    "ACTIVE": "active",
    "WORKING": "active",
    "SCANNING": "scan",
    "CHARGING": "charge",
    "DAMAGED": "damaged",
    "CORRUPTED": "corrupt",
    "OVERHEATED": "damaged",
    "FAILED": "damaged"
  },
  "anchors": {
    "core": [
      0.0,
      1.7,
      0.0
    ],
    "eyes": [
      0.0,
      2.15,
      -0.35
    ],
    "trail": [
      0.0,
      0.18,
      0.55
    ],
    "ground": [
      0.0,
      0.04,
      0.0
    ],
    "exhaust": [
      0.0,
      0.6,
      0.65
    ],
    "scanner": [
      0.0,
      1.95,
      -0.45
    ]
  },
  "preview": {
    "title": "command_remnant RenderCore mob visual",
    "notes": "command remnant boss; black command armor, red/orange core",
    "artifact": "art_sources/echo_mob_rendercore/source_sheets/echo_rendercore_entity_atlas_sheet.png",
    "screenshot": {
      "enabled": false,
      "reason": "Generated atlas coverage asset; in-game screenshot pass is manual."
    }
  }
}
